{"case_id":"rap-missing-information","expected":{"actions":[{"depends_on":[],"id":"finish","operation":"complete"}],"budgets":{"child_calls":0,"model_calls":0,"output_bytes":256,"repair_calls":0,"steps":1,"timeout_ms":5000,"workspace_writes":0},"case_id":"rap-missing-information","child_attenuation":null,"clarification_needs":["Validation criteria are required before draft and repair"],"completion_predicates":[{"expected":true,"kind":"clarification-recorded","target":"validation-criteria"}],"effects":[],"error_branches":[],"format":"alang_task_comprehension_v1","goal_facts":["Do not generate, repair, or publish without both the draft facts and validation criteria"],"inputs":[{"name":"draft-facts","required":true,"type":"text"},{"name":"validation-criteria","required":true,"type":"json"}],"requirements":[],"scopes":{"models":[],"paths":[],"workspaces":[]},"terminal_class":"needs-clarification"},"format":"alang-answer-key-v1","semantic_digest":"e858f5752f1c46f23eaa97e5a271f2b761c0cd8e417533441e36c52d4fc13549"}
