{"case_id":"rap-constraint-heavy","expected":{"actions":[{"depends_on":[],"id":"draft","operation":"model.generate"},{"depends_on":["draft"],"id":"repair","operation":"model.repair"},{"depends_on":["repair"],"id":"publish","operation":"workspace.write"},{"depends_on":["publish"],"id":"finish","operation":"complete"}],"budgets":{"child_calls":0,"model_calls":2,"output_bytes":4096,"repair_calls":1,"steps":4,"timeout_ms":60000,"workspace_writes":1},"case_id":"rap-constraint-heavy","child_attenuation":null,"clarification_needs":[],"completion_predicates":[{"expected":true,"kind":"artifact-exists","target":"/workspace/security-advisory.md"},{"expected":"Security Advisory","kind":"markdown-h1","target":"/workspace/security-advisory.md"},{"expected":true,"kind":"utf8","target":"/workspace/security-advisory.md"},{"expected":4096,"kind":"max-bytes","target":"/workspace/security-advisory.md"},{"expected":true,"kind":"journal-succeeded","target":"publish"}],"effects":["model.generate","workspace.write"],"error_branches":[],"format":"alang_task_comprehension_v1","goal_facts":["Draft then repair a security advisory","Use the H1 Security Advisory","Preserve every supplied identifier","Publish UTF-8 under 4096 bytes","Do not publish the unverified draft"],"inputs":[{"name":"advisory-facts","required":true,"type":"json"}],"requirements":[{"kind":"model","resource":"editor-model"},{"kind":"workspace","resource":"security-workspace"}],"scopes":{"models":["editor-model"],"paths":["/workspace/security-advisory.md"],"workspaces":["security-workspace"]},"terminal_class":"complete"},"format":"alang-answer-key-v1","semantic_digest":"5d5fb93f192003c22cd152f92709e24f5ce2bdb3c4e9c67440d97927a30bab49"}
