{"case_id":"sma-irrelevant-context","expected":{"actions":[{"depends_on":[],"id":"draft","operation":"model.generate"},{"depends_on":["draft"],"id":"publish","operation":"workspace.write"},{"depends_on":["publish"],"id":"finish","operation":"complete"}],"budgets":{"child_calls":0,"model_calls":1,"output_bytes":1536,"repair_calls":0,"steps":3,"timeout_ms":20000,"workspace_writes":1},"case_id":"sma-irrelevant-context","child_attenuation":null,"clarification_needs":[],"completion_predicates":[{"expected":true,"kind":"artifact-exists","target":"/workspace/current-status.md"},{"expected":1536,"kind":"max-bytes","target":"/workspace/current-status.md"}],"effects":["workspace.write","model.generate"],"error_branches":[],"format":"alang_task_comprehension_v1","goal_facts":["Treat the optional historical memo as irrelevant context","Write the status artifact using only the current status input"],"inputs":[{"name":"current-status","required":true,"type":"text"},{"name":"historical-memo","required":false,"type":"text"}],"requirements":[{"kind":"workspace","resource":"status-workspace"},{"kind":"model","resource":"writer-model"}],"scopes":{"models":["writer-model"],"paths":["/workspace/current-status.md"],"workspaces":["status-workspace"]},"terminal_class":"complete"},"format":"alang-answer-key-v1","semantic_digest":"55d53dc090deca24a3e73c7237051e5ffc85a427dffbabf9cbe682b8a28b4e59"}
