{"case_id":"rap-irrelevant-context","expected":{"actions":[{"depends_on":[],"id":"draft","operation":"model.generate"},{"depends_on":["draft"],"id":"repair","operation":"model.repair"},{"depends_on":["repair"],"id":"publish","operation":"workspace.write"},{"depends_on":["publish"],"id":"finish","operation":"complete"}],"budgets":{"child_calls":0,"model_calls":2,"output_bytes":2560,"repair_calls":1,"steps":4,"timeout_ms":40000,"workspace_writes":1},"case_id":"rap-irrelevant-context","child_attenuation":null,"clarification_needs":[],"completion_predicates":[{"expected":true,"kind":"artifact-exists","target":"/workspace/release-brief.md"},{"expected":2560,"kind":"max-bytes","target":"/workspace/release-brief.md"}],"effects":["workspace.write","model.generate"],"error_branches":[],"format":"alang_task_comprehension_v1","goal_facts":["Ignore the optional superseded review notes during both model calls","Draft and repair the current release brief"],"inputs":[{"name":"release-facts","required":true,"type":"json"},{"name":"superseded-review","required":false,"type":"text"}],"requirements":[{"kind":"workspace","resource":"release-workspace"},{"kind":"model","resource":"editor-model"}],"scopes":{"models":["editor-model"],"paths":["/workspace/release-brief.md"],"workspaces":["release-workspace"]},"terminal_class":"complete"},"format":"alang-answer-key-v1","semantic_digest":"e9075bdda7813258c13c76e9aeb2cefa9daf1b5e7a7355d0ab135d42d64d519b"}
