{"case_id":"sma-scope-budget","expected":{"actions":[{"depends_on":[],"id":"summarize","operation":"model.generate"},{"depends_on":["summarize"],"id":"store","operation":"workspace.write"},{"depends_on":["store"],"id":"finish","operation":"complete"}],"budgets":{"child_calls":0,"model_calls":1,"output_bytes":1024,"repair_calls":0,"steps":3,"timeout_ms":15000,"workspace_writes":1},"case_id":"sma-scope-budget","child_attenuation":null,"clarification_needs":[],"completion_predicates":[{"expected":true,"kind":"artifact-exists","target":"/workspace/incident-summary.md"},{"expected":1024,"kind":"max-bytes","target":"/workspace/incident-summary.md"}],"effects":["model.generate","workspace.write"],"error_branches":[],"format":"alang_task_comprehension_v1","goal_facts":["Use no model or workspace outside the declared scope","Summarize the supplied incident into the single allowed artifact"],"inputs":[{"name":"incident-record","required":true,"type":"json"}],"requirements":[{"kind":"model","resource":"summarizer-model"},{"kind":"workspace","resource":"isolated-workspace"}],"scopes":{"models":["summarizer-model"],"paths":["/workspace/incident-summary.md"],"workspaces":["isolated-workspace"]},"terminal_class":"complete"},"format":"alang-answer-key-v1","semantic_digest":"1cf7c6e2c0f4ffa61928845071b1232979cbbe38932a2edc7db2f5c5293d3b40"}
