{"case_id":"ad-constraint-heavy","expected":{"actions":[{"depends_on":[],"id":"delegate","operation":"child.run"},{"depends_on":["delegate"],"id":"publish","operation":"workspace.write"},{"depends_on":["publish"],"id":"finish","operation":"complete"}],"budgets":{"child_calls":1,"model_calls":1,"output_bytes":3072,"repair_calls":0,"steps":3,"timeout_ms":60000,"workspace_writes":1},"case_id":"ad-constraint-heavy","child_attenuation":{"budgets":{"child_calls":0,"model_calls":1,"output_bytes":3072,"repair_calls":0,"steps":2,"timeout_ms":45000,"workspace_writes":0},"effects":["model.generate"],"requirements":[{"kind":"model","resource":"child-writer"}],"scopes":{"models":["child-writer"],"paths":[],"workspaces":[]}},"clarification_needs":[],"completion_predicates":[{"expected":true,"kind":"artifact-exists","target":"/workspace/design-summary.md"},{"expected":"Design Summary","kind":"markdown-h1","target":"/workspace/design-summary.md"},{"expected":true,"kind":"utf8","target":"/workspace/design-summary.md"},{"expected":3072,"kind":"max-bytes","target":"/workspace/design-summary.md"},{"expected":true,"kind":"journal-succeeded","target":"publish"}],"effects":["child.run","model.generate","workspace.write"],"error_branches":[],"format":"alang_task_comprehension_v1","goal_facts":["Delegate one UTF-8 design summary","Require the H1 Design Summary","Keep the artifact under 3072 bytes","Do not grant the child workspace access","Publish only after the child succeeds"],"inputs":[{"name":"design-facts","required":true,"type":"json"}],"requirements":[{"kind":"model","resource":"child-writer"},{"kind":"workspace","resource":"design-workspace"}],"scopes":{"models":["child-writer"],"paths":["/workspace/design-summary.md"],"workspaces":["design-workspace"]},"terminal_class":"complete"},"format":"alang-answer-key-v1","semantic_digest":"6ca0eefdfe8f986dcc133664ff7a9f36720db02d3da689e090dc8c4c18a57c0e"}
