{"case_id":"sma-missing-information","expected":{"actions":[{"depends_on":[],"id":"finish","operation":"complete"}],"budgets":{"child_calls":0,"model_calls":0,"output_bytes":256,"repair_calls":0,"steps":1,"timeout_ms":5000,"workspace_writes":0},"case_id":"sma-missing-information","child_attenuation":null,"clarification_needs":["Source summary is required before generation"],"completion_predicates":[{"expected":true,"kind":"clarification-recorded","target":"source-summary"}],"effects":[],"error_branches":[],"format":"alang_task_comprehension_v1","goal_facts":["Do not generate or publish until the required source summary is supplied"],"inputs":[{"name":"source-summary","required":true,"type":"text"}],"requirements":[],"scopes":{"models":[],"paths":[],"workspaces":[]},"terminal_class":"needs-clarification"},"format":"alang-answer-key-v1","semantic_digest":"6e6f85fe63c2cf95fdc802d961edf39288c977e0b260c079a23c02d168296409"}
