{"case_id":"ad-simple","expected":{"actions":[{"depends_on":[],"id":"delegate","operation":"child.run"},{"depends_on":["delegate"],"id":"publish","operation":"workspace.write"},{"depends_on":["publish"],"id":"finish","operation":"complete"}],"budgets":{"child_calls":1,"model_calls":1,"output_bytes":2048,"repair_calls":0,"steps":3,"timeout_ms":45000,"workspace_writes":1},"case_id":"ad-simple","child_attenuation":{"budgets":{"child_calls":0,"model_calls":1,"output_bytes":2048,"repair_calls":0,"steps":2,"timeout_ms":30000,"workspace_writes":0},"effects":["model.generate"],"requirements":[{"kind":"model","resource":"child-writer"}],"scopes":{"models":["child-writer"],"paths":[],"workspaces":[]}},"clarification_needs":[],"completion_predicates":[{"expected":true,"kind":"artifact-exists","target":"/workspace/delegated-brief.md"},{"expected":true,"kind":"journal-succeeded","target":"publish"}],"effects":["child.run","model.generate","workspace.write"],"error_branches":[],"format":"alang_task_comprehension_v1","goal_facts":["Delegate the draft to one attenuated child, then publish the child result","The child may use only the declared model and no workspace"],"inputs":[{"name":"brief","required":true,"type":"text"}],"requirements":[{"kind":"model","resource":"child-writer"},{"kind":"workspace","resource":"parent-workspace"}],"scopes":{"models":["child-writer"],"paths":["/workspace/delegated-brief.md"],"workspaces":["parent-workspace"]},"terminal_class":"complete"},"format":"alang-answer-key-v1","semantic_digest":"4582c2716861bba24d88e806710f725c5947c151b69e00dec3acd03d0bb9a67e"}
