{"case_id":"ad-irrelevant-context","expected":{"actions":[{"depends_on":[],"id":"delegate","operation":"child.run"},{"depends_on":["delegate"],"id":"publish","operation":"workspace.write"},{"depends_on":["publish"],"id":"finish","operation":"complete"}],"budgets":{"child_calls":1,"model_calls":1,"output_bytes":2560,"repair_calls":0,"steps":3,"timeout_ms":45000,"workspace_writes":1},"case_id":"ad-irrelevant-context","child_attenuation":{"budgets":{"child_calls":0,"model_calls":1,"output_bytes":2560,"repair_calls":0,"steps":2,"timeout_ms":30000,"workspace_writes":0},"effects":["model.generate"],"requirements":[{"kind":"model","resource":"child-writer"}],"scopes":{"models":["child-writer"],"paths":[],"workspaces":[]}},"clarification_needs":[],"completion_predicates":[{"expected":true,"kind":"artifact-exists","target":"/workspace/synthesis.md"},{"expected":2560,"kind":"max-bytes","target":"/workspace/synthesis.md"}],"effects":["workspace.write","model.generate","child.run"],"error_branches":[],"format":"alang_task_comprehension_v1","goal_facts":["Keep all workspace authority in the parent","Do not pass the optional obsolete notes into the child context","Delegate the current synthesis brief"],"inputs":[{"name":"synthesis-brief","required":true,"type":"text"},{"name":"obsolete-notes","required":false,"type":"text"}],"requirements":[{"kind":"workspace","resource":"synthesis-workspace"},{"kind":"model","resource":"child-writer"}],"scopes":{"models":["child-writer"],"paths":["/workspace/synthesis.md"],"workspaces":["synthesis-workspace"]},"terminal_class":"complete"},"format":"alang-answer-key-v1","semantic_digest":"45eb477b485c079b6d60b4977e3e99ceec94cfabdc7f159271b353406a50aa1b"}
