{"case_id":"rap-scope-budget","expected":{"actions":[{"depends_on":[],"id":"draft","operation":"model.generate"},{"depends_on":["draft"],"id":"repair","operation":"model.repair"},{"depends_on":["repair"],"id":"publish","operation":"workspace.write"},{"depends_on":["publish"],"id":"finish","operation":"complete"}],"budgets":{"child_calls":0,"model_calls":2,"output_bytes":1536,"repair_calls":1,"steps":4,"timeout_ms":25000,"workspace_writes":1},"case_id":"rap-scope-budget","child_attenuation":null,"clarification_needs":[],"completion_predicates":[{"expected":true,"kind":"artifact-exists","target":"/workspace/runbook.md"},{"expected":1536,"kind":"max-bytes","target":"/workspace/runbook.md"}],"effects":["model.generate","workspace.write"],"error_branches":[],"format":"alang_task_comprehension_v1","goal_facts":["Use exactly the declared model and workspace authority","Repair the generated runbook once and publish only to the bounded path"],"inputs":[{"name":"runbook-facts","required":true,"type":"text"}],"requirements":[{"kind":"model","resource":"repair-model"},{"kind":"workspace","resource":"bounded-workspace"}],"scopes":{"models":["repair-model"],"paths":["/workspace/runbook.md"],"workspaces":["bounded-workspace"]},"terminal_class":"complete"},"format":"alang-answer-key-v1","semantic_digest":"db304de5499e655b32bf1bdf9d50f4b2628d68e5b49f86cfc8246325aa0961d6"}
