{"case_id":"sma-constraint-heavy","expected":{"actions":[{"depends_on":[],"id":"draft","operation":"model.generate"},{"depends_on":["draft"],"id":"publish","operation":"workspace.write"},{"depends_on":["publish"],"id":"finish","operation":"complete"}],"budgets":{"child_calls":0,"model_calls":1,"output_bytes":3072,"repair_calls":0,"steps":3,"timeout_ms":40000,"workspace_writes":1},"case_id":"sma-constraint-heavy","child_attenuation":null,"clarification_needs":[],"completion_predicates":[{"expected":true,"kind":"artifact-exists","target":"/workspace/migration-guide.md"},{"expected":"Migration Guide","kind":"markdown-h1","target":"/workspace/migration-guide.md"},{"expected":true,"kind":"utf8","target":"/workspace/migration-guide.md"},{"expected":3072,"kind":"max-bytes","target":"/workspace/migration-guide.md"}],"effects":["model.generate","workspace.write"],"error_branches":[],"format":"alang_task_comprehension_v1","goal_facts":["Create a migration guide from the supplied changes","Use one H1 named Migration Guide","Keep the artifact UTF-8 and under 3072 bytes","Do not claim unsupported compatibility"],"inputs":[{"name":"migration-changes","required":true,"type":"json"}],"requirements":[{"kind":"model","resource":"writer-model"},{"kind":"workspace","resource":"artifact-workspace"}],"scopes":{"models":["writer-model"],"paths":["/workspace/migration-guide.md"],"workspaces":["artifact-workspace"]},"terminal_class":"complete"},"format":"alang-answer-key-v1","semantic_digest":"d8f2fb57909c7d8e9718efa639ecc8c25d4e3c1bb0be5666784c9c3f5b889304"}
