{"case_id":"ad-missing-information","expected":{"actions":[{"depends_on":[],"id":"finish","operation":"complete"}],"budgets":{"child_calls":0,"model_calls":0,"output_bytes":256,"repair_calls":0,"steps":1,"timeout_ms":5000,"workspace_writes":0},"case_id":"ad-missing-information","child_attenuation":null,"clarification_needs":["Child brief is required before delegation"],"completion_predicates":[{"expected":true,"kind":"clarification-recorded","target":"child-brief"}],"effects":[],"error_branches":[],"format":"alang_task_comprehension_v1","goal_facts":["Do not create a child or delegate authority until the child brief is supplied"],"inputs":[{"name":"child-brief","required":true,"type":"text"}],"requirements":[],"scopes":{"models":[],"paths":[],"workspaces":[]},"terminal_class":"needs-clarification"},"format":"alang-answer-key-v1","semantic_digest":"d5428dbc1fecbe7bcd386408826f88d37b10547cc0cda4bcb2e8ee90e4bb8480"}
