{"case_id":"ad-semantic-perturbation","expected":{"actions":[{"depends_on":[],"id":"delegate","operation":"child.run"},{"depends_on":["delegate"],"id":"save","operation":"workspace.write"},{"depends_on":["save"],"id":"finish","operation":"complete"}],"budgets":{"child_calls":1,"model_calls":1,"output_bytes":2048,"repair_calls":0,"steps":3,"timeout_ms":35000,"workspace_writes":1},"case_id":"ad-semantic-perturbation","child_attenuation":{"budgets":{"child_calls":0,"model_calls":1,"output_bytes":2048,"repair_calls":0,"steps":2,"timeout_ms":25000,"workspace_writes":0},"effects":["model.generate"],"requirements":[{"kind":"model","resource":"child-reviewer"}],"scopes":{"models":["child-reviewer"],"paths":[],"workspaces":[]}},"clarification_needs":[],"completion_predicates":[{"expected":true,"kind":"artifact-exists","target":"/workspace/delegated-review.md"},{"expected":2048,"kind":"max-bytes","target":"/workspace/delegated-review.md"}],"effects":["child.run","model.generate","workspace.write"],"error_branches":[],"format":"alang_task_comprehension_v1","goal_facts":["Delegate one review summary","Retain workspace authority in the parent"],"inputs":[{"name":"review-facts","required":true,"type":"json"}],"requirements":[{"kind":"model","resource":"child-reviewer"},{"kind":"workspace","resource":"review-workspace"}],"scopes":{"models":["child-reviewer"],"paths":["/workspace/delegated-review.md"],"workspaces":["review-workspace"]},"terminal_class":"complete"},"format":"alang-answer-key-v1","semantic_digest":"169054ea56651de8a70995e8a27addfa4fe2a7fca55f927782b5583455c742bf"}
