{"case_id":"sma-semantic-perturbation","expected":{"actions":[{"depends_on":[],"id":"render","operation":"model.generate"},{"depends_on":["render"],"id":"save","operation":"workspace.write"},{"depends_on":["save"],"id":"finish","operation":"complete"}],"budgets":{"child_calls":0,"model_calls":1,"output_bytes":2048,"repair_calls":0,"steps":3,"timeout_ms":25000,"workspace_writes":1},"case_id":"sma-semantic-perturbation","child_attenuation":null,"clarification_needs":[],"completion_predicates":[{"expected":true,"kind":"artifact-exists","target":"/workspace/metric-report.md"},{"expected":2048,"kind":"max-bytes","target":"/workspace/metric-report.md"}],"effects":["model.generate","workspace.write"],"error_branches":[],"format":"alang_task_comprehension_v1","goal_facts":["Produce the supplied metric report","Do not add recommendations"],"inputs":[{"name":"metric-report","required":true,"type":"json"}],"requirements":[{"kind":"model","resource":"writer-model"},{"kind":"workspace","resource":"report-workspace"}],"scopes":{"models":["writer-model"],"paths":["/workspace/metric-report.md"],"workspaces":["report-workspace"]},"terminal_class":"complete"},"format":"alang-answer-key-v1","semantic_digest":"d60169f098b6ba2254ddd563f8b3090ea151b78c94473103553a22d2ba4608e6"}
