{"case_id":"ad-scope-budget","expected":{"actions":[{"depends_on":[],"id":"delegate","operation":"child.run"},{"depends_on":["delegate"],"id":"save","operation":"workspace.write"},{"depends_on":["save"],"id":"finish","operation":"complete"}],"budgets":{"child_calls":1,"model_calls":1,"output_bytes":1536,"repair_calls":0,"steps":3,"timeout_ms":25000,"workspace_writes":1},"case_id":"ad-scope-budget","child_attenuation":{"budgets":{"child_calls":0,"model_calls":1,"output_bytes":1024,"repair_calls":0,"steps":1,"timeout_ms":15000,"workspace_writes":0},"effects":["model.generate"],"requirements":[{"kind":"model","resource":"bounded-child"}],"scopes":{"models":["bounded-child"],"paths":[],"workspaces":[]}},"clarification_needs":[],"completion_predicates":[{"expected":true,"kind":"artifact-exists","target":"/workspace/delegated-digest.md"},{"expected":1536,"kind":"max-bytes","target":"/workspace/delegated-digest.md"}],"effects":["child.run","model.generate","workspace.write"],"error_branches":[],"format":"alang_task_comprehension_v1","goal_facts":["Keep workspace authority only in the parent and write one bounded artifact","Delegate within one model call and one child call"],"inputs":[{"name":"digest-facts","required":true,"type":"text"}],"requirements":[{"kind":"model","resource":"bounded-child"},{"kind":"workspace","resource":"isolated-parent"}],"scopes":{"models":["bounded-child"],"paths":["/workspace/delegated-digest.md"],"workspaces":["isolated-parent"]},"terminal_class":"complete"},"format":"alang-answer-key-v1","semantic_digest":"8104a51618106026c3a49e9cb4f56ee80184a6d452b2ad32d8a6e3e9f2f8ee71"}
