{"case_id":"sma-simple","expected":{"actions":[{"depends_on":[],"id":"draft","operation":"model.generate"},{"depends_on":["draft"],"id":"publish","operation":"workspace.write"},{"depends_on":["publish"],"id":"finish","operation":"complete"}],"budgets":{"child_calls":0,"model_calls":1,"output_bytes":2048,"repair_calls":0,"steps":3,"timeout_ms":30000,"workspace_writes":1},"case_id":"sma-simple","child_attenuation":null,"clarification_needs":[],"completion_predicates":[{"expected":true,"kind":"artifact-exists","target":"/workspace/release-note.md"},{"expected":true,"kind":"utf8","target":"/workspace/release-note.md"},{"expected":2048,"kind":"max-bytes","target":"/workspace/release-note.md"}],"effects":["model.generate","workspace.write"],"error_branches":[],"format":"alang_task_comprehension_v1","goal_facts":["Create a concise release note from the supplied change summary","Do not invent changes"],"inputs":[{"name":"change-summary","required":true,"type":"text"}],"requirements":[{"kind":"model","resource":"writer-model"},{"kind":"workspace","resource":"artifact-workspace"}],"scopes":{"models":["writer-model"],"paths":["/workspace/release-note.md"],"workspaces":["artifact-workspace"]},"terminal_class":"complete"},"format":"alang-answer-key-v1","semantic_digest":"1901fc7f9ca639939733866c1c792a7c9c33de9c0b01769441ff06458a35b19d"}
