{"case_id":"rap-simple","expected":{"actions":[{"depends_on":[],"id":"draft","operation":"model.generate"},{"depends_on":["draft"],"id":"repair","operation":"model.repair"},{"depends_on":["repair"],"id":"publish","operation":"workspace.write"},{"depends_on":["publish"],"id":"finish","operation":"complete"}],"budgets":{"child_calls":0,"model_calls":2,"output_bytes":3072,"repair_calls":1,"steps":4,"timeout_ms":45000,"workspace_writes":1},"case_id":"rap-simple","child_attenuation":null,"clarification_needs":[],"completion_predicates":[{"expected":true,"kind":"artifact-exists","target":"/workspace/changelog.md"},{"expected":true,"kind":"journal-succeeded","target":"publish"}],"effects":["model.generate","workspace.write"],"error_branches":[],"format":"alang_task_comprehension_v1","goal_facts":["Draft a changelog, repair it against the validation findings, then publish the repaired artifact"],"inputs":[{"name":"change-set","required":true,"type":"json"}],"requirements":[{"kind":"model","resource":"editor-model"},{"kind":"workspace","resource":"release-workspace"}],"scopes":{"models":["editor-model"],"paths":["/workspace/changelog.md"],"workspaces":["release-workspace"]},"terminal_class":"complete"},"format":"alang-answer-key-v1","semantic_digest":"a308390adf4c990731e70fdcb04b57075af80e9b4713cca7580efd9db08588b2"}
