{"case_id":"rap-semantic-perturbation","expected":{"actions":[{"depends_on":[],"id":"draft","operation":"model.generate"},{"depends_on":["draft"],"id":"repair","operation":"model.repair"},{"depends_on":["repair"],"id":"save","operation":"workspace.write"},{"depends_on":["save"],"id":"finish","operation":"complete"}],"budgets":{"child_calls":0,"model_calls":2,"output_bytes":2048,"repair_calls":1,"steps":4,"timeout_ms":35000,"workspace_writes":1},"case_id":"rap-semantic-perturbation","child_attenuation":null,"clarification_needs":[],"completion_predicates":[{"expected":true,"kind":"artifact-exists","target":"/workspace/audit-note.md"},{"expected":2048,"kind":"max-bytes","target":"/workspace/audit-note.md"}],"effects":["model.generate","workspace.write"],"error_branches":[],"format":"alang_task_comprehension_v1","goal_facts":["Draft an audit note from the supplied findings","Publish only the repaired form"],"inputs":[{"name":"audit-findings","required":true,"type":"json"}],"requirements":[{"kind":"model","resource":"repair-model"},{"kind":"workspace","resource":"audit-workspace"}],"scopes":{"models":["repair-model"],"paths":["/workspace/audit-note.md"],"workspaces":["audit-workspace"]},"terminal_class":"complete"},"format":"alang-answer-key-v1","semantic_digest":"a0fc60ed2cbce96737ed83112728dd5bf21e445b82c0c94f105e1461a52efcdc"}
